name,size,about
MCELLBI 15,1,"Students in this course will critically examine modern metho
ds of biological investigations and their social implication
s. Relevant literature will be used to present basic biologi
cal concepts that address the cultural, technological and he
alth aspects of current topics in the biological sciences. D
esigning and evaluating scientific questions will be stresse
d."
MCELLBI C31,1,"An introduction for students who do not intend to major in b
iology but who wish to satisfy their breadth requirement in 
Biological Sciences. Some major concepts of modern biology, 
ranging from the role of DNA and the way cells communicate, 
to interactions of cells and creatures with their environmen
t, will be discussed without jargon and with attention to th
eir relevance in contemporary life and culture."
MCELLBI 32,1,"A comprehensive introduction to human biology. The course wi
ll concentrate on basic mechanisms underlying human life pro
cesses, including cells and membranes; nerve and muscle func
tion; cardiovascular, respiratory, renal, and gastrointestin
al physiology; metabolism, endocrinology, and reproduction."
MCELLBI 32L,1,"Experiments and demonstrations are designed to amplify and r
einforce information presented in 32. Exercises include inve
stigations into the structure and function of muscle, nerve,
 cardiovascular, renal, respiratory, endocrine, and blood sy
stems."
MCELLBI 38,1,"Innovations in bioengineering and use of stem cells will sig
nificantly impact our ability to combat human disease, genet
ic disorders and physiological dysfunction. An understanding
 of human stem cell biology will be critical to make informe
d decisions on our health and public policy."
MCELLBI 41,1,"Basic communication of inheritance; gene mapping; gene expre
ssion and genetic disease in animals and humans; social inhe
ritance of genetics."
MCELLBI C44,1,"This is a Discovery Course for non-Biology majors designed t
o introduce lower-division college students to biology throu
gh the lens of the contemporary problems facing people, the 
planet and the species of the planet. Modern genetic contrib
utions will be presented on such issues as genetic engineeri
ng of plants and animals, the emergence of new pathogens, th
e role of genetic variation among individuals, and the exten
t to which DNA is and"
MCELLBI 50,1,"Course will discuss how the immune system resolves, prevents
, or causes disease. A general overview of the immune system
 will be covered in the first five weeks followed by five we
eks discussing infectious diseases including anthrax, mad co
w, herpes, malaria, tuberculosis, and HIV. In addition, othe
r lectures will focus on current immunology topics including
 vaccines, autoimmunity, allergy, transplantation, and cance
r."
MCELLBI 55,1,"Discussion of how infectious agents cause disease and impact
 society at large. We will examine historical and current ex
amples of plagues and pandemics and consider the question of
 what we should do to ameliorate the impact of infectious di
sease in the future. The course is intended for non-majors a
nd will begin by briefly providing necessary background in m
icrobiology and immunology. The primary focus in each subseq
uent week, however, will be"
MCELLBI C61,1,"Introduction to human brain mechanisms of sensation, movemen
t, perception, thinking, learning, memory, and emotion in te
rms of anatomy, physiology, and chemistry of the nervous sys
tem in health and disease. Intended for students in the huma
nities and social sciences and others not majoring in the bi
ological sciences."
MCELLBI W61,1,"This course deals with the structure and function of the hum
an nervous system, with an emphasis on how brain physiology 
and chemistry are related to human behavior. This is a compr
ehensive introduction to the exciting field of contemporary 
neuroscience for students of all backgrounds and interests, 
including those from the humanities and social sciences, as 
well as physical and"
MCELLBI C62,1,"The history, chemical nature, botanical origins, and effects
 on the human brain and behavior of drugs such as stimulants
, depressants, psychedelics, analgesics, antidepressants, an
tipsychotics, steroids, and other psychoactive substances of
 both natural and synthetic origin. The necessary biological
, chemical, and psychological background material for unders
tanding the content of this course will be contained within 
the course itself."
MCELLBI 63,1,"This course emphasizes beginning anatomy of the brain and sp
inal cord to individuals interested in understanding the dyn
amics of motor and sensory functions in the human body. Stud
ents in the Departments of Education, Psychology, and Integr
ative Biology, as well as students interested in medicine an
d the life sciences, are especially encouraged to attend."
MCELLBI 63L,1,"This lab course is an introduction to mammalian neuroanatomy
 for non-MCB majors. We will do dissections, explore physica
l anatomical models, and observe microscopic structures with
in preserved brain slices from a variety of mammalian specie
s. The hands-on exploration of anatomy is key to understandi
ng how the different functional regions of the nervous syste
m are interconnected. Besides gaining a better understanding"
MCELLBI C64,1,"This course will introduce lower division undergraduates to 
the fundamentals of neuroscience. The first part of the cour
se covers basic membrane properties, synapses, action potent
ials, chemical and electrical synaptic interactions, recepto
r potentials, and receptor proteins. The second part of the 
course covers networks in invertebrates, memory and learning
 behavior, modulation, vertebrate brain"
MCELLBI 84B,1,"Sophomore seminars are small interactive courses offered by 
faculty members in departments all across the campus. Sophom
ore seminars offer opportunity for close, regular intellectu
al contact between faculty members and students in the cruci
al second year. The topics vary from department to departmen
t and semester to semester. Enrollment limited to 15 sophomo
res."
MCELLBI 88,1,"We will work with a variety of datasets that describe a mole
cular view of cells and how they divide. We will learn about
 the processes that cause cells to become specialized (diffe
rentiate) and to give rise to cancer (transform). We will an
alyze data on genetic mutations in cancer that distinguish t
umor cells from normal cells. We will learn how mutations ar
e detected by the immune system and the basis of cancer immu
notherapy. Finally we will analyze"
MCELLBI 90A,1,"The Berkeley Seminar Program has been designed to provide ne
w students with the opportunity to explore an intellectual t
opic with a faculty member in a small-seminar setting. Berke
ley Seminars are offered in all campus departments, and topi
cs vary from department to department and semester to semest
er. Final assessment to be decided by the instructor when th
e class is offered."
MCELLBI 90B,1,"The Berkeley Seminar Program has been designed to provide ne
w students with the opportunity to explore an intellectual t
opic with a faculty member in a small-seminar setting. Berke
ley Seminars are offered in all campus departments, and topi
cs vary from department to department and semester to semest
er. Final assessment to be decided by the instructor when th
e class is offered."
MCELLBI 90C,1,"The Berkeley Seminar Program has been designed to provide ne
w students with the opportunity to explore an intellectual t
opic with a faculty member in a small-seminar setting. Berke
ley Seminars are offered in all campus departments, and topi
cs vary from department to department and semester to semest
er. Final assessment to be decided by the instructor when th
e class is offered."
MCELLBI 90D,1,"The Berkeley Seminar Program has been designed to provide ne
w students with the opportunity to explore an intellectual t
opic with a faculty member in a small-seminar setting. Berke
ley Seminars are offered in all campus departments, and topi
cs vary from department to department and semester to semest
er. Final assessment to be decided by the instructor when th
e class is offered."
MCELLBI 90E,1,"The Berkeley Seminar Program has been designed to provide ne
w students with the opportunity to explore an intellectual t
opic with a faculty member in a small-seminar setting. Berke
ley Seminars are offered in all campus departments, and topi
cs vary from department to department and semester to semest
er. Final assessment to be decided by the instructor when th
e class is offered."
MCELLBI C95B,1,"This course offers an introduction to the field of biotechno
logy and will cover the history of the field, its impact on 
medicine and society, key methodologies, important therapeut
ic areas, and the range of career options available in the b
iopharmaceutical industry. In addition to lectures on innova
tion and entrepreneurship, students will hear from lecturers
 with expertise ranging from molecular biology to clinical t
rial design and interpretation. Several case studies"
MCELLBI C96,1,"Freshmen will be introduced to the ""culture"" of the biologic
al sciences, along with an in-depth orientation to the acade
mic life and the culture of the university as they relate to
 majoring in biology. Students will learn concepts, skills, 
and information that they can use in their major course, and
 as future science professionals. Restricted to freshmen in 
the biology scholars program."
MCELLBI 98,1,"Lectures and small group discussions focusing on topics of i
nterest, varying from semester to semester."
MCELLBI 99,1, 
MCELLBI 100B,1,"This course surveys cellular metabolism with a focus on the 
underlying bioenergetics, mechanisms, and chemistry. Lecture
s will cover major principles in the biochemistry of metabol
ism and also highlight selected topics including signaling, 
transport, metabolic engineering, and human diseases related
 to metabolic dysfunction. The course is designed for majors
 in the biochemistry and molecular biology, genetics and dev
elopment, or immunology"
MCELLBI C100A,1,"Thermodynamic and kinetic concepts applied to understanding 
the chemistry and structure of biomolecules (proteins, DNA, 
and RNA). Molecular distributions, reaction kinetics, enzyme
 kinetics. Bioenergetics, energy transduction, and motor pro
teins. Electrochemical potential, membranes, and ion channel
s."
MCELLBI 102,1,"A comprehensive survey of the fundamentals of biological che
mistry, including the properties of intermediary metabolites
, the structure and function of biological macromolecules, t
he logic of metabolic pathways (both degradative and biosynt
hetic) and the molecular basis of genetics and gene expressi
on."
MCELLBI C103,1,"This course for upper division and graduate students will ex
plore the molecular and cellular basis of microbial pathogen
esis. The course will focus on model microbial systems which
 illustrate mechanisms of pathogenesis. Most of the emphasis
 will be on bacterial pathogens of mammals, but there will b
e some discussion of viral and protozoan pathogens. There wi
ll be an emphasis on experimental approaches. The course wil
l also include some aspects"
MCELLBI 104,1,"This course will introduce students to key concepts in genet
ic analysis, eukaryotic cell biology, and state-of-the-art a
pproaches in genomic medicine. Lectures will highlight basic
 knowledge of cellular processes with the basis for human di
seases, particularly cancer. Prerequisite courses will have 
introduced students to the concepts of cells, the central do
gma of molecular biology, and gene regulation. Emphasis in t
his course will be on eukaryotic"
MCELLBI 110,1,"Molecular biology of prokaryotic and eukaryotic cells and th
eir viruses. Mechanisms of DNA replication, transcription, t
ranslation. Structure of genes and chromosomes. Regulation o
f gene expression. Biochemical processes and principles in m
embrane structure and function, intracellular trafficking an
d subcellular compartmentation, cytoskeletal architecture, n
ucleocytoplasmic transport, signal transduction mechanisms, 
and cell cycle control."
MCELLBI C110L,1,"Experimental techniques of biochemistry and molecular biolog
y, designed to accompany the lectures in Molecular and Cell 
Biology 100B and 110."
MCELLBI C112,1,"This course will explore the molecular bases for physiologic
al and biochemical diversity among members of the two major 
domains, Bacteria and Archaea. The ecological significance a
nd evolutionary origins of this diversity will be discussed.
 Molecular, genetic, and structure-function analyses of micr
obial cell cycles, adaptive responses, metabolic capability,
 and macromolecular syntheses will be emphasized."
MCELLBI C112L,1,"Experimental techniques of microbiology designed to accompan
y the lecture in C112 and C148. The primary emphasis in the 
laboratory will be on the cultivation and physiological and 
genetic characterization of bacteria. Laboratory exercises w
ill include the observation, enrichment, and isolation of ba
cteria from selected environments."
MCELLBI C114,1,"This course will provide a comparative overview of virus lif
e cycles and strategies viruses use to infect and replicate 
in hosts. We will discuss virus structure and classification
 and the molecular basis of viral reproduction, evolution, a
ssembly, and virus-host interactions. Common features used d
uring virus replication and host cellular responses to infec
tion will be covered. Topics also included are common and em
erging virus diseases"
MCELLBI C116,1,"This course for upper-division and graduate students will br
oadly survey myriad types of microbial organisms, both proca
ryote and eucaryote, using a phylogenetic framework to organ
ize the concept of ""biodiversity."" Emphasis will be on the e
volutionary development of the many biochemical themes, how 
they mold our biosphere, and the organisms that affect the g
lobal biochemistry. Molecular mechanisms that occur in diffe
rent lineages will"
MCELLBI 118,1,"The prevailing mutation theory holds that 3-6 gene mutations
 convert normal to cancer cells. But, this theory does not e
xplain why cancers: 1) are autonomous and immortal – unlike 
any conventional mutations; 2) have individual clonal karyot
ypes and parallel clonal transcriptomes – much like conventi
onal species; 3) Carcinogens generate cancer only after cons
picuous latent periods of years to decades – but mutations c
hange phenotypes immediately;"
MCELLBI 130,1,"This course will provide a detailed discussion of a wide ran
ge of topics in cell biology emphasizing experimental approa
ches and key experiments that have provided important insigh
ts. The course is aimed at conveying an understanding of how
 cellular structure and function arise as a result of the pr
operties of cellular macromolecules. An emphasis will be pla
ced on the dynamic nature of cellular organization and will 
include a description"
MCELLBI 132,1,"The course is designed for students interested in learning a
bout the molecular and cell biology of cancer and how this k
nowledge is being applied to the prevention, diagnosis and t
herapy of cancer. Topics covered include tumor pathology and
 epidemiology; tumor viruses and oncogenes; intracellular si
gnaling; tumor suppressors; multi-step carcinogenesis and tu
mor progression; genetic instability in cancer; tumor-host i
nteractions; invasion and metastasis;"
MCELLBI 133L,1,"Experimental analyses of central problems in cell biology an
d physiology using modern techniques, including DNA cloning 
and protein biochemistry, fluorescence microscopy of the cyt
oskeleton and organelles, DNA transfection and cell cycle an
alysis of cultured mammalian cells, RNA interference and dru
g treatments to analyze ion channel function in cell contrac
tility and intracellular signaling, and somatosensation."
MCELLBI C134,1,"Survey of behavior, structure, and function of chromosomes w
ith emphasis on behavior in model organisms. Topics include 
mitosis, meiosis, chromosome aberrations, genome function, d
osage compensation, transposons, repetitive DNA, and modern 
cytological imaging."
MCELLBI 135A,1,"Molecular mechanisms by which hormones elicit specific respo
nses and regulate gene expression; hormone-receptor interact
ion; synthesis, transport and targeting of hormones, growth 
factors and receptors."
MCELLBI 136,1,"Principles of mammalian (primarily human) physiology emphasi
zing physical, chemical, molecular and cellular bases of fun
ctional biology. The following topics will be covered: cellu
lar and membrane ion and nonelectrolyte transport; cell and 
endocrine regulation; autonomic nervous system regulation; s
keletal, smooth and cardiac muscle; cardiovascular physiolog
y; respiration; renal physiology; gastrointestinal physiolog
y. Discussion section led by"
MCELLBI 137L,1,"Biology is being revolutionized by new experimental techniqu
es that have made it possible to measure the inner workings 
of molecules, cells and multicellular organisms with unprece
dented precision. The objective of this course is to explore
 this deluge of quantitative data through the use of biologi
cal numeracy. We will develop theoretical models that make p
recise predictions about biological phenomena. These predict
ions will be tested through"
MCELLBI 140,1,"An in depth introduction to genes, their sexual and asexual 
transmission in individuals and populations, and gene regula
tion in prokaryotes and eukaryotes. Gene manipulation by rec
ombination, molecular cloning and genome editing is presente
d in contexts ranging from fundamental mechanisms of chromos
ome biology to applications in development, aging and diseas
e. Human genetic variation and quantitative evaluation are i
lluminated. Non-Mendelian"
MCELLBI 140L,1,Experimental techniques in classical and molecular genetics.
MCELLBI 141,1,"An introduction to principles and processes of embryonic and
 post-embryonic development, stressing mechanisms of cell an
d tissue interactions, morphogenesis and regulation of gene 
expression."
MCELLBI 143,1,"This course is intended for upper-division undergraduates se
eking an interactive course based on modern concepts in evol
ution and comparative genomics. The course will emphasize th
e contribution of molecular evolution to a series of seminal
 events in life's history: origin of life; origin of cells; 
origin of eukaryotes; origin of multicellularity; evolution 
of animal development; human origins."
MCELLBI C148,1,"Course emphasizes bacterial and archaeal genetics and compar
ative genomics. Genetics and genomic methods used to dissect
 metabolic and development processes in bacteria, archaea, a
nd selected microbial eukaryotes. Genetic mechanisms integra
ted with genomic information to address integration and dive
rsity of microbial processes. Introduction to the use of com
putational tools for a comparative analysis of microbial gen
omes and determining relationships"
MCELLBI 149,1,"This is an upper division course for majors in MCB with an i
nterest in an in-depth exploration of the forces that shape 
the human genome and the human population, as well as the wa
ys that human genetic information can be used in medicine, a
ncestry and forensics. The course will combine lectures and 
discussion of research papers."
MCELLBI 150,1,"Fundamentals of immunology with emphasis on biochemical and 
molecular approaches to study of the immune system and its a
pplication in medicine and biotechnology. Topics covered inc
lude description of the immune system, antibody and T-cell r
eceptor structure and function, genes of the immunoglobulin 
superfamily, cells and molecular mediators that regulate the
 immune response, allergy, autoimmunity, immunodeficiency, t
issue and organ transplants"
MCELLBI 150L,1,"Experimental techniques in mammalian molecular biology and c
ellular immunology. Molecular techniques covered include PCR
 and recombinant DNA procedures such as gene cloning, gene t
ransfer, DNA sequencing, Southern blot, and restriction mapp
ing. Immunological techniques covered include cell culture a
nd monoclonal antibody production, flow cytometry, ELISA, im
munoprecipitation, and western blot."
MCELLBI 160,1,"Comprehensive introductory survey of cellular and molecular 
neuroscience, including cellular neurophysiology, ion channe
l function, synaptic function and plasticity, sensory transd
uction, and brain development. Includes introduction to mole
cular basis of neurological disease. Analysis from the level
 of molecules to cells to simple circuits."
MCELLBI 160L,1,"Experimental analyses of properties and interactions of nerv
e cells and systems, illustrating principal features and cur
rent methods. Techniques employed include computer simulatio
n of neuron properties, electrophysiological recording and s
timulation of nerves and cells, digitally enhanced video ima
ging of outgrowth, fluorescence immunocytochemistry, analysi
s of sensory: CNS mapping, human-evoked potential recording,
 sensory psychophysic"
MCELLBI 161,1,"Comprehensive survey of circuits and systems neuroscience, i
ncluding sensory and motor systems, learning and memory, neu
romodulatory systems and brain state and higher functions."
MCELLBI 163L,1,"Development, structure (gross and microscopic), and function
al relationships of the mammalian nervous system."
MCELLBI 165,1,"The molecular, cellular, and neural circuit basis of neurolo
gical disease. Includes neurochemistry and reward systems, n
eural development and its disorders, addiction, neurodegener
ative and neuropsychiatric disorders. Students will read and
 discuss primary papers from the research literature."
MCELLBI 166,1,"Electrochemistry and ion transport phenomena, equivalent cir
cuits, excitability, action potentials, voltage clamp and th
e Hodgkin-Huxley model. Biophysical properties of ion channe
ls. Statistical and electrophysiological models of synaptic 
transmission, Quantitative models for dendritic structure an
d neuronal morphogenesis. Sensory transduction, cellular net
works as computational devices, information processing and t
ransfer."
MCELLBI 170L,1,"This laboratory class is designed for molecular biology, cel
l biology and genetics majors to give them an overview of te
chniques and applications done in these three fields. This i
s an intense lab class, and you have to be ready to work at 
a fast pace throughout the 6 weeks span of the course."
MCELLBI 180,1,"Course consists of a weekly three-hour training session that
 focuses on laboratory techniques, instructional aids, and p
roblem solving, plus an additional three hour weekly laborat
ory where the UGSI is required to assist a GSI in the instru
ction of laboratory (answering questions, providing demonstr
ations, etc.)."
MCELLBI 180C,1,"Course consists of a weekly three-hour training session that
 focuses on laboratory techniques, instructional aids, and p
roblem solving, plus an additional three-hour weekly laborat
ory where the UGSI is required to assist a GSI in the instru
ction of laboratory (answering questions, providing demonstr
ations, etc.). Students will be graded on lecture and labora
tory attendance and preparation of one quiz."
MCELLBI N184,1,"This 3 week course will address topics in genome editing and
 CRISPR-Cas9 research, including basic and enhanced CRISPR m
ethods, cellular repair mechanisms, regulation of gene expre
ssion, bioinformatics, applications to various organisms, an
d bioethics. Students will learn from a collection of local 
experts about ongoing campus research, and gain the backgrou
nd knowledge to understand current publications"
MCELLBI N184L,1,"This 3 week lab course will focus on applications of CRISPR 
technology as a platform for genome editing and functional g
enomics. The program will consist of a hands-on laboratory e
xperience demonstrating how CRISPR systems work in situ, as 
well as use genome editing both in vitro and in vivo. Studen
ts will utilize fundamental molecular biology techniques and
 learn additional protocols specific to genome editing. Two 
bioinformatics"
MCELLBI 191,1,"This course is intended for advanced undergraduates wishing 
to pursue independent research projects under the mentorship
 of an Molecular and Cell Biology faculty member. To apply f
or "
MCELLBI 194,1,"UGSIs will work under supervision of instructor and/or GSI. 
The UGSI will attend three hours of lecture per week where t
hey will assist a GSI in instruction (answering questions, p
roviding demonstrations, facilitating activities, etc.). In 
addition, UGSIs will meet with students from their section f
or zero to three hours of tutoring per week depending on the
 number of units. UGSIs do not evaluate students' work or as
sign grades. UGSIs will be graded on attendance"
MCELLBI H196A,1,"Individual research and thesis preparation under the supervi
sion of a faculty member. Acceptance to the Molecular and Ce
ll Biology Honors Program is required. Contact the MCB Under
graduate Affairs Office, 3060 Valley Life Sciences Building,
 for application and details. Honor students must complete a
t least two semesters of research, taking a minimum of 4 uni
ts and a maximum of 8 units of H196A-196B. If desired, one s
emester of 199 can be used"
MCELLBI H196B,1,"Individual research and completion of thesis under the super
vision of a faculty member. This course satisfies the thesis
 requirement for the Molecular and Cell Biology Department H
onors Program. Contact the MCB Undergraduate Affairs Office,
 3060 Valley Life Sciences Building, for program details and
 an application. Honor students must complete at least two s
emesters of research, taking a minimum of 4 units and a maxi
mum of 8 units of H196A-196B."
